{
  "$schema": "./mesh-roster-1.schema.json",
  "contract": "mesh-roster/1",
  "generated": "2026-09-29",
  "x-note": "Charter present/roles/valid are MEASURED from a sibling checkout when present, null when the repo is not checked out (unread, never zero). served.handshake is null everywhere: proving a domain serves the handshake needs a live fetch this survey does not make. provision is pending for all until a person runs provision-org-from-charter with DATABASE_URL.",
  "orgs": [
    {
      "repo": "FlashyLabs/flashyos",
      "org": "flashyos",
      "kind": "platform",
      "charter": {
        "present": true,
        "roles": 10,
        "valid": true
      },
      "listing": "public",
      "served": {
        "domain": null,
        "handshake": null
      },
      "provision": "pending"
    },
    {
      "repo": "FlashyLabs/flashy-network",
      "org": "flashy-network",
      "kind": "platform",
      "charter": {
        "present": true,
        "roles": 3,
        "valid": true
      },
      "listing": "public",
      "served": {
        "domain": null,
        "handshake": null
      },
      "provision": "pending"
    },
    {
      "repo": "FlashyLabs/flashy-group",
      "org": "flashy-group",
      "kind": "platform",
      "charter": {
        "present": true,
        "roles": 4,
        "valid": true
      },
      "listing": "public",
      "served": {
        "domain": null,
        "handshake": null
      },
      "provision": "pending"
    },
    {
      "repo": "FlashyLabs/flashyid",
      "org": "flashyid",
      "kind": "platform",
      "charter": {
        "present": true,
        "roles": 4,
        "valid": true
      },
      "listing": "public",
      "served": {
        "domain": null,
        "handshake": null
      },
      "provision": "pending"
    },
    {
      "repo": "FlashyLabs/flashy-finance",
      "org": "flashy-finance",
      "kind": "platform",
      "charter": {
        "present": true,
        "roles": 6,
        "valid": true
      },
      "listing": "public",
      "served": {
        "domain": null,
        "handshake": null
      },
      "provision": "pending"
    },
    {
      "repo": "FlashyLabs/ClaimYour.Gold",
      "org": "claimyour-gold",
      "kind": "platform",
      "charter": {
        "present": true,
        "roles": 9,
        "valid": true
      },
      "listing": "public",
      "served": {
        "domain": null,
        "handshake": null
      },
      "provision": "pending"
    },
    {
      "repo": "FlashyLabs/flashy-gold",
      "org": "flashy-gold",
      "kind": "platform",
      "charter": {
        "present": true,
        "roles": 3,
        "valid": true
      },
      "listing": "public",
      "served": {
        "domain": null,
        "handshake": null
      },
      "provision": "pending"
    },
    {
      "repo": "FlashyLabs/flashy-academy",
      "org": "flashy-academy",
      "kind": "platform",
      "charter": {
        "present": true,
        "roles": 12,
        "valid": true
      },
      "listing": "public",
      "served": {
        "domain": null,
        "handshake": null
      },
      "provision": "pending"
    },
    {
      "repo": "FlashyLabs/flashy-labs",
      "org": "flashy-labs",
      "kind": "platform",
      "charter": {
        "present": true,
        "roles": 5,
        "valid": true
      },
      "listing": "public",
      "served": {
        "domain": null,
        "handshake": null
      },
      "provision": "pending"
    },
    {
      "repo": "FlashyLabs/flashy-rails",
      "org": "flashy-rails",
      "kind": "platform",
      "charter": {
        "present": true,
        "roles": 5,
        "valid": true
      },
      "listing": "public",
      "served": {
        "domain": null,
        "handshake": null
      },
      "provision": "pending"
    },
    {
      "repo": "FlashyLabs/magician",
      "org": "magician",
      "kind": "platform",
      "charter": {
        "present": true,
        "roles": 7,
        "valid": true
      },
      "listing": "public",
      "served": {
        "domain": null,
        "handshake": null
      },
      "provision": "pending"
    },
    {
      "repo": "FlashyLabs/intentmesh",
      "org": "intentmesh",
      "kind": "platform",
      "charter": {
        "present": true,
        "roles": 5,
        "valid": true
      },
      "listing": "public",
      "served": {
        "domain": null,
        "handshake": null
      },
      "provision": "pending"
    },
    {
      "repo": "FlashyLabs/therealm",
      "org": "therealm",
      "kind": "platform",
      "charter": {
        "present": true,
        "roles": 4,
        "valid": true
      },
      "listing": "public",
      "served": {
        "domain": null,
        "handshake": null
      },
      "provision": "pending"
    },
    {
      "repo": "FlashyLabs/chronicle",
      "org": "chronicle",
      "kind": "platform",
      "charter": {
        "present": true,
        "roles": 3,
        "valid": true
      },
      "listing": "public",
      "served": {
        "domain": null,
        "handshake": null
      },
      "provision": "pending"
    },
    {
      "repo": "FlashyLabs/bastion",
      "org": "bastion",
      "kind": "platform",
      "charter": {
        "present": true,
        "roles": 5,
        "valid": true
      },
      "listing": "public",
      "served": {
        "domain": null,
        "handshake": null
      },
      "provision": "pending"
    },
    {
      "repo": "FlashyLabs/flashy-tools",
      "org": "flashy-tools",
      "kind": "platform",
      "charter": {
        "present": true,
        "roles": 3,
        "valid": true
      },
      "listing": "public",
      "served": {
        "domain": null,
        "handshake": null
      },
      "provision": "pending"
    },
    {
      "repo": "FlashyLabs/gold-holdings",
      "org": "gold-holdings",
      "kind": "platform",
      "charter": {
        "present": true,
        "roles": 6,
        "valid": true
      },
      "listing": "public",
      "served": {
        "domain": null,
        "handshake": null
      },
      "provision": "pending"
    },
    {
      "repo": "FlashyLabs/gda-group",
      "org": "gda-group",
      "kind": "platform",
      "charter": {
        "present": true,
        "roles": 6,
        "valid": true
      },
      "listing": "public",
      "served": {
        "domain": null,
        "handshake": null
      },
      "provision": "pending"
    },
    {
      "repo": "FlashyLabs/botz-group",
      "org": "botz-group",
      "kind": "platform",
      "charter": {
        "present": true,
        "roles": 5,
        "valid": true
      },
      "listing": "public",
      "served": {
        "domain": null,
        "handshake": null
      },
      "provision": "pending"
    },
    {
      "repo": "FlashyLabs/metaverse-group",
      "org": "metaverse-group",
      "kind": "platform",
      "charter": {
        "present": true,
        "roles": 6,
        "valid": true
      },
      "listing": "public",
      "served": {
        "domain": null,
        "handshake": null
      },
      "provision": "pending"
    },
    {
      "repo": "FlashyLabs/intent-spec",
      "org": "intent-spec",
      "kind": "spec",
      "charter": {
        "present": true,
        "roles": 5,
        "valid": true
      },
      "listing": "public",
      "served": {
        "domain": null,
        "handshake": null
      },
      "provision": "pending"
    },
    {
      "repo": "FlashyLabs/flashyid-spec",
      "org": "flashyid-spec",
      "kind": "spec",
      "charter": {
        "present": true,
        "roles": 5,
        "valid": true
      },
      "listing": "public",
      "served": {
        "domain": null,
        "handshake": null
      },
      "provision": "pending"
    },
    {
      "repo": "FlashyLabs/agent-wellknown",
      "org": "agent-wellknown",
      "kind": "spec",
      "charter": {
        "present": true,
        "roles": 5,
        "valid": true
      },
      "listing": "public",
      "served": {
        "domain": null,
        "handshake": null
      },
      "provision": "pending"
    },
    {
      "repo": "FlashyLabs/agent-dns",
      "org": "agent-dns",
      "kind": "spec",
      "charter": {
        "present": true,
        "roles": 5,
        "valid": true
      },
      "listing": "public",
      "served": {
        "domain": null,
        "handshake": null
      },
      "provision": "pending"
    },
    {
      "repo": "FlashyLabs/agentgraph",
      "org": "agentgraph",
      "kind": "spec",
      "charter": {
        "present": true,
        "roles": 5,
        "valid": true
      },
      "listing": "public",
      "served": {
        "domain": null,
        "handshake": null
      },
      "provision": "pending"
    },
    {
      "repo": "FlashyLabs/agentpay",
      "org": "agentpay",
      "kind": "spec",
      "charter": {
        "present": true,
        "roles": 5,
        "valid": true
      },
      "listing": "public",
      "served": {
        "domain": null,
        "handshake": null
      },
      "provision": "pending"
    },
    {
      "repo": "FlashyLabs/stack.json",
      "org": "stack-json",
      "kind": "spec",
      "charter": {
        "present": true,
        "roles": 5,
        "valid": true
      },
      "listing": "public",
      "served": {
        "domain": null,
        "handshake": null
      },
      "provision": "pending"
    },
    {
      "repo": "FlashyLabs/web4",
      "org": "web4",
      "kind": "spec",
      "charter": {
        "present": true,
        "roles": 5,
        "valid": true
      },
      "listing": "public",
      "served": {
        "domain": null,
        "handshake": null
      },
      "provision": "pending"
    },
    {
      "repo": "FlashyLabs/aao",
      "org": "aao",
      "kind": "spec",
      "charter": {
        "present": true,
        "roles": 5,
        "valid": true
      },